First name	Last name	Party	Phrase	Occupation	Subject area
Edward	Leigh	Conservative	Durham University	reputation owing to his opposition to abortion and controversial genetic research, and for his defence of Section , History , as a barrister at the Inner Temple, and practised in arbitration and criminal law as a member of Goldsmiths Chambers, barrister and an Assembly Member of the Council of Europe, 	Politician	Law
Charlotte	Leslie	Conservative	Balliol College, Oxford	Classics at Balliol College, Oxford, in 	No occupation found	Historical & philosophical studies
Christopher	Leslie	Labour	No university found		No occupation found	
Oliver	Letwin	Conservative	Eton College	at Trinity College, Cambridge, by the Cambridge Philosophy Faculty in 	No occupation found	Historical & philosophical studies
Emma	Lewell-Buck	Labour	Northumbria University	politics and media studies at Northumbria University, , Masters degree in social work from Durham University	No occupation found	Social studies
Brandon	Lewis	Conservative	Forest School	degree in economics from the University of Buckingham, , barrister	Politician	Social studies
Ivan	Lewis	Labour	No university found		No occupation found	
Julian	Lewis	Conservative	No university found		No occupation found	
Ian	Liddell-Grainger	Conservative	No university found	National Certificate of Agriculture at the South Scotland Agricultural College in Edinburgh	No occupation found	Agriculture & related subjects
David	Lidington	Conservative	Sidney Sussex College, Cambridge	History and a PhD in 	No occupation found	Historical & philosophical studies
Peter	Lilley	Conservative	Clare College, Cambridge	Economics and Physics	No occupation found	Physical sciences
Stephen	Lloyd	Liberal Democrat	St. George's College, Weybridge		Business Development Consultant	
Elfyn	Llwyd	Plaid Cymru	University of Wales, Aberystwyth		Barrister	
Naomi	Long	Alliance	Queen's University Belfast	from Queen, number of death threats along with petrol bomb being thrown inside an unmarked police car guarding her constituency office	Engineer	Other
Jack	Lopresti	Conservative	No university found		No occupation found	
Jonathan	Lord	Conservative	Merton College, Oxford[1]	in 	Marketing, politician	Other
Tim	Loughton	Conservative	University of Warwick	first class BA in classical civilisation in 	Securities Fund Manager	Historical & philosophical studies
Andrew	Love	Labour	No university found	from the University of Houston with a B, acting and directing	Voice actor/Actor	Other
Caroline	Lucas	Green	University of Exeter	first, of woman as reader in Elizabethan romance, , , , of the likely impacts of climate change upon South East England, 	No occupation found	Other
Ian	Lucas	Labour	New College, Oxford	jurisprudence gaining a BA in , from the College of Law in , Solicitor	No occupation found	Law
Peter	Luff	Conservative	Corpus Christi College, Cambridge	at Corpus Christi College, Cambridge, receiving a BA in Economics in 	No occupation found	Social studies
Karen	Lumley	Conservative	No university found		No occupation found	
Mary	Macleod	Conservative	University of Glasgow	from University of Glasgow	Business Consultant	Other
Angus	MacNeil	Scottish National Party	University of Strathclyde	from Strathclyde University with a degree in civil engineering 	Engineer, reporter, teacher	Engineering & technology
Fiona	Mactaggart	Labour	The Cheltenham Ladies' College	for a BA in English at King, list about the ethical differences between legal waged labour and prostitution	Teaching	Law
Khalid	Mahmood	Labour	UCE Birmingham		No occupation found	
Shabana	Mahmood	Labour	Lincoln College, Oxford	from Lincoln College, Oxford, where she studied law and was the president of the Junior Common Room	No occupation found	Law
Anne	Main	Conservative	University of Sheffield, Swansea University	English at Swansea University obtaining a BA Hons, where she met her first husband, Stephen, PGCE from Sheffield University	No occupation found	Languages
Seema	Malhotra	Labour	University of Warwick		No occupation found	
John	Mann	Labour	No university found		No occupation found	
Gordon	Marsden	Labour	New College, Oxford	Modern History	No occupation found	Historical & philosophical studies
Paul	Maskey	Sinn Fein	No university found		Politician	Other
Francis	Maude	Conservative	Corpus Christi College, Cambridge		No occupation found	
Theresa	May	Conservative	St Hugh's College, Oxford	place at the former Holton Park Girls, Geography at St Hugh, with a BA , more than 	No occupation found	Social studies
Paul	Maynard	Conservative	University College, Oxford	First Class History degree at University College, Oxford	No occupation found	Historical & philosophical studies
Stephen	McCabe	Labour	No university found		No occupation found	
Michael	McCann	Labour	No university found		No occupation found	
Kerry	McCarthy	Labour	University of Liverpool	Russian Studies, she then studied law at City of London Polytechnic, solicitor	No occupation found	Law
Jason	McCartney	Conservative	Leeds Trinity &amp; All Saints[3]	for a postgraduate diploma in broadcast journalism, 	Journalist, Broadcaster, RAF Officer	Mass communications & documentation
Karl	McCartney	Conservative	University of Wales, Lampeter	Geography at St David	No occupation found	Social studies
Gregg	McClymont	Labour	University of Glasgow	History at the University of Glasgow, graduating in , at the University of Pennsylvania	Historian	Historical & philosophical studies
William	McCrea	DUP	Raveanhill Theological Hall		Clergyman	
Siobhain	McDonagh	Labour	University of Essex	Politics at the University of Essex	No occupation found	Social studies
Andrew	McDonald	Labour	No university found		No occupation found	
Alasdair	McDonnell	Social Democratic and Labour Party	University College Dublin	in , in OLSPCK in Belfast
References edit	Politician	Other
John	McDonnell	Labour	Brunel University	for A	No occupation found	Other
Pat	McFadden	Labour	University of Edinburgh	Politics at the University of Edinburgh, gaining an MA in 	No occupation found	Social studies
Alison	McGovern	Labour	University College London	Philosophy at University College London	No occupation found	Historical & philosophical studies
Jim	McGovern	Labour	No university found		No occupation found	
Anne	McGuire	Labour	University of Glasgow	a MA in politics with history, for teacher training at the Notre Dame College of Education , Diploma in Secondary Education	No occupation found	Social studies
Anne	McIntosh	Conservative	University of Edinburgh	at the University of Aarhus in the Jutland region of Denmark, by the Royal College of Physicians, which found that 	No occupation found	Physical sciences
Ann	McKechin	Labour	University of Strathclyde	Scots law at the University of Strathclyde	Solicitor in Scots law	Law
Iain	McKenzie	Labour	No university found		No occupation found	
Catherine	McKinnell	Labour	University of Edinburgh	politics and history at the University of Edinburgh, and before her election to Parliament she worked as an employment solicitor in the Newcastle law firm Dickinson Dees, becoming one of , OBE if allegations of tax avoidance were proven 	Solicitor	Social studies
Patrick	McLoughlin	Conservative	No university found		No occupation found	
Stephen	McPartland	Conservative	No university found		No occupation found	
Esther	McVey	Conservative	Queen Mary, University of London	from Liverpool John Moores University with a Distinction for her Master of Science in Corporate Governance, and won the North of England Excellence Award for her studies	Company Director;	Other
Michael	Meacher	Labour	New College, Oxford	Diploma in Social Administration, reputation for being a politician who was on top of a complex brief 	No occupation found	Social studies
Alan	Meale	Labour	Sheffield	at Ruskin College, and Durham University, 	No occupation found	Other
Ian	Mearns	Labour	No university found		No occupation found	
Mark	Menzies	Conservative	University of Glasgow	from the University of Glasgow, where he was President of the Conservative Association, in , economic and social history	No occupation found	Social studies
Stephen	Metcalfe	Conservative	No university found		No occupation found	
Edward	Miliband	Labour	No university found		No occupation found	
Andrew	Miller	Labour	University of Portsmouth	at the London School of Economics where he was awarded a diploma in industrial relations in 	No occupation found	Social studies
Maria	Miller	Conservative	London School of Economics	Economics at the London School of Economics from where she graduated in 	No occupation found	Social studies
Nigel	Mills	Conservative	University of Newcastle-upon-Tyne	Classics at Newcastle University, as a Chartered Accountant in , The Spectator	No occupation found	Business & administrative studies
Anne	Milton	Conservative	Haywards Heath Grammar School		Minister of State for Health	
Andrew	Mitchell	Conservative	Jesus College, Cambridge	History at Jesus College, with a Bachelor of Arts degree in , public apology from the Commissioner of the Metropolitan Police, Bernard Hogan	No occupation found	Historical & philosophical studies
Austin	Mitchell	Labour	University of Manchester		No occupation found	
Francie	Molloy	Sinn Fein	No university found		No occupation found	
Madeleine	Moon	Labour	Keele University	Cert Ed in , BEd in , CQSW and Diploma in Social Work , higher public profile due to an increased number of suicides of young people from her constituency	Social Worker	Social studies
Michael	Moore	Liberal Democrat	No university found	in , the Palme d	Actor, director, screenwriter, producer, documentarian	Other
Penny	Mordaunt	Conservative	No university found	philosophy at the University of Reading	No occupation found	Historical & philosophical studies
Jessica	Morden	Labour	University of Birmingham	History at University of Birmingham	No occupation found	Historical & philosophical studies
Nicky	Morgan	Conservative	St Hugh's College, Oxford	Jurisprudence at St Hugh, as a solicitor in , a Department of Health grant for development of a device with the potential to provide an early diagnosis of peripheral arterial disease	No occupation found	Law
Graeme	Morrice	Labour	Edinburgh Napier University	a SHND in Business Studies	MP	Business & administrative studies
Anne-Marie	Morris	Conservative	No university found		No occupation found	
David	Morris	Conservative	No university found		No occupation found	
Grahame	Morris	Labour	No university found		No occupation found	
James	Morris	Conservative	No university found		No occupation found	
Stephen	Mosley	Conservative	University of Nottingham	Chemistry at the University of Nottingham	IT Consultant	Physical sciences
David	Mowat	Conservative	Imperial College London	engineering at Imperial College London, as a Chartered Accountant and subsequently joined the consultancy firm Accenture 	Chartered Accountant	Engineering & technology
George	Mudie	Labour	No university found	Social Studies at Newbattle Abbey College in Dalkeith	No occupation found	Social studies
Greg	Mulholland	Liberal Democrat	University of York	politics at the University of York, going on to achieve an MA in Public Administration and Public Policy, politics for A, and was dropped before becoming law	No occupation found	Social studies
David	Mundell	Conservative	University of Edinburgh	Law at the University of Edinburgh, also gaining a Diploma in Legal Practice, law in 	No occupation found	Law
Meg	Munn	Labour	University of Nottingham, University of York	languages at the University of York receiving a BA , Certificate and Diploma in Management Studies from the Open University and in , Chartered Manager status by the Chartered Management Institute	No occupation found	Business & administrative studies
Tessa	Munt	Liberal Democrat	No university found		No occupation found	
Conor	Murphy	Sinn Fein	University of Ulster, Queen's University of Belfast		No occupation found	Other
Jim	Murphy	Labour	University of Strathclyde (did not graduate)	Politics and European Law at the University of Strathclyde, although in the event he did not graduate after 	None	Social studies
Paul	Murphy	Labour	No university found		No occupation found	
Ian	Murray	Labour	No university found		No occupation found	
Sheryll	Murray	Conservative	No university found		No occupation found	
Andrew	Murrison	Conservative	University of Bristol	as a doctor from the University of Bristol medical school in 	Physician	Medicine & dentistry
Lisa	Nandy	Labour	Newcastle University	from Newcastle University, Tyne and Wear, in , politics and obtained a master, public policy from Birkbeck, University of London	No occupation found	Social studies
Pamela	Nash	Labour	No university found	politics at the University of Glasgow, specialising in human rights and international development	No occupation found	Social studies
Bob	Neill	Conservative	London School of Economics		Politician	
Brooks	Newmark	Conservative	Worcester College, Oxford	from Harvard College, receiving a BA in History in 	No occupation found	Historical & philosophical studies
Sarah	Newton	Conservative	King's College London	History, before completing a Master, the United States of America, studying as a Rotary International Scholar	Politician	Historical & philosophical studies
Caroline	Nokes	Conservative	University of Sussex	politics at the University of Sussex from 	No occupation found	Social studies
Jesse	Norman	Conservative	Eton College	with a , at University College London, where he held an honorary research fellowship in philosophy and obtained a PhD in 	No occupation found	Historical & philosophical studies
David	Nuttall	Conservative	University of London	as a fellow of the Institute of Legal Executives, and obtained a law degree by correspondence from the University of London	Notary public	Law
Stephen	O'Brien	Conservative	Emmanuel College, Cambridge	as a Solicitor in 	No occupation found	Law
Fiona	O'Donnell	Labour	No university found		No occupation found	
Matthew	Offord	Conservative	Nottingham Trent University	at both Lancaster University where he received his masters degree, and King, a PhD in 	Political Analyst at the BBC [2]	Other
Eric	Ollerenshaw	Conservative	London School of Economics	a Bachelor of Science degree in Economics in , his OBE for Public and Political Service	No occupation found	Social studies
Chi	Onwurah	Labour	No university found	at Newcastle Medical School when they met and married in the , Electrical Engineering from Imperial College London in , for an MBA at Manchester Business School, and long walks in the countryside 	No occupation found	Medicine & dentistry
Guy	Opperman	Conservative	University of Buckingham	law from the University of Buckingham and a first class diploma from the University of Lille, France, the Bar Pro Bono Award by the Attorney General, Lord Goldsmith QC, for his voluntary work on behalf of victims in Criminal Injuries Compensation Appeals, a 	No occupation found	Social studies
George	Osborne	Conservative	St Paul's School	, , Modern History, in , formal complaint initiated in a letter by the Liberal Democrats, edit	No occupation found	Historical & philosophical studies
Sandra	Osborne	Labour	Strathclyde University	part, Master of Science in Equality and Discrimination	No occupation found	Other
Richard	Ottaway	Conservative	Britannia Royal Naval College	law at Bristol University, graduating in , as a solicitor in 	No occupation found	Law
Albert	Owen	Labour	University of York	BA in Politics in 	No occupation found	Social studies
James	Paice	Conservative	No university found	National Diploma in Agriculture in 	No occupation found	Agriculture & related subjects
Ian	Paisley Jnr	DUP	No university found		No occupation found	
Neil	Parish	Conservative	No university found		No occupation found	
Priti	Patel	Conservative	Keele University	economics at Keele University and then going on to the University of Essex	No occupation found	Social studies
Owen	Paterson	Conservative	Corpus Christi College, Cambridge	History at Corpus Christi College	No occupation found	Historical & philosophical studies
Mark	Pawsey	Conservative	Reading University	degree in Estate Management	Businessman	Business & administrative studies
Teresa	Pearce	Labour	No university found		Senior Manager PricewaterhouseCoopers	
Michael	Penning	Conservative	No university found		No occupation found	
John	Penrose	Conservative	Downing College, Cambridge; Columbia University	at Downing College, Cambridge, receiving a BA in Law in 	No occupation found	Law
Andrew	Percy	Conservative	University of York	degree at the University of York and studied at the University of Leeds as a post	No occupation found	Other
Toby	Perkins	Labour	No university found	as a rugby coach in 	Politician	Other
Claire	Perry	Conservative	Brasenose College, Oxford,	Geography, graduating in , MBA at Harvard University, and was due to be debated again on 	MP for Devizes	Social studies
Stephen	Phillips	Conservative	No university found	classics	No occupation found	Historical & philosophical studies
Bridget	Phillipson	Labour	Hertford College, Oxford	Modern History at Hertford College, Oxford, with a BA , Modern History	No occupation found	Historical & philosophical studies
Eric	Pickles	Conservative	Leeds Polytechnic	at Leeds Polytechnic, chief executives listed in The Times, on , in the House of Lords on , High Court judicial review of the Christian prayers held during meetings in council chambers, that non	No occupation found	Other
Christopher	Pincher	Conservative	London School of Economics		IT consultant	Other
Daniel	Poulter	Conservative	University of Bristol	medical doctor and has served as a Parliamentary Under Secretary of State in the Department of Health since September , with a Law degree, before qualifying as a medical doctor at King	Politician	Medicine & dentistry
Stephen	Pound	Labour	London School of Economics	Diploma in Industrial Relations and a BSc in Economics	Politician	Social studies
Lucy	Powell	Labour	Somerville College, Oxford	chemistry at Somerville College, Oxford and King	No occupation found	Physical sciences
Dawn	Primarolo	Labour	Bristol Polytechnic	at Bristol Polytechnic as a bookkeeper and legal secretary, for a social science degree at Bristol Polytechnic, where she gained a BA , out a question on behalf of Ann Clwyd, at the time, who had 	No occupation found	Social studies
Mark	Prisk	Conservative	University of Reading	Land Management at the University of Reading, gaining a BSc degree	No occupation found	Agriculture & related subjects
Mark	Pritchard	Conservative	London Guildhall University	at the London Guildhall University and has a Master of Arts degree in Marketing Management	No occupation found	Business & administrative studies
John	Pugh	Liberal Democrat	Durham University	from Durham University, , Philosophy	No occupation found	Historical & philosophical studies
Yasmin	Qureshi	Labour	Polytechnic of the South Bank, University College London	BA , Master of Laws at University College London	Member of Parliament	Law
Dominic	Raab	Conservative	University of Oxford	law, Masters from Cambridge University, majority of , Westminster Hall debate to call on the government not to unfairly penalise Surrey Police as part of their consultation on reform of police funding	Lawyer	Social studies
John	Randall	Conservative	University of London	from the University of London with an Upper Second degree BA in Serbo	No occupation found	Social studies
Nick	Raynsford	Labour	Sidney Sussex College, Cambridge	with a BA degree in History in 	No occupation found	Historical & philosophical studies
Mark	Reckless	Conservative	Marlborough College	in PPE, him the nickname Mark Legless	Politician, barrister, economist	Social studies
John	Redwood	Conservative	Magdalen College, Oxford	at St Antony, somewhat haughty reputation with apparent disregard for national feeling	No occupation found	Other
Jamie	Reed	Labour	Manchester Metropolitan University		No occupation found	
Steve	Reed	Labour	University of Sheffield	English at Sheffield University	No occupation found	Languages
Jacob	Rees-Mogg	Conservative	Eton College	history at Trinity College, Oxford, reputation for his humorous speeches and ability to filibuster	Politician	Historical & philosophical studies
Simon	Reevell	Conservative	Manchester Polytechnic, Lincoln's Inn	Economics, he embarked on a career in the army but this was cut short by injury	Barrister	Social studies
Rachel	Reeves	Labour	New College, Oxford	Philosophy, Politics and Economics at New College, Oxford, followed by an MSc in Economics from the London School of Economics, the effects of the policy on Japan in the early , and walking	Economist	Social studies
Alan	Reid	Liberal Democrat	University of Strathclyde	BSc in Mathematics	No occupation found	Mathematical sciences
Emma	Reynolds	Labour	Wadham College, Oxford	at Wadham College at the University of Oxford, where she read Politics, Philosophy and Economics	Lobbyist	Social studies
Jonathan	Reynolds	Labour	University of Manchester	Politics and Modern History at the University of Manchester and BPP Law School 	Trainee Solicitor	Social studies
Malcolm	Rifkind	Conservative	University of Edinburgh	law before taking a postgraduate degree in political science , reputation as being a moderate voice on social and economic issues, and sometimes had disputes with Margaret Thatcher, knighthood in John Major	Advocate	Social studies
Linda	Riordan	Labour	University of Bradford	from the University of Bradford, of parliamentary records was published in the Daily Telegraph	No occupation found	Other
Margaret	Ritchie	Social Democratic and Labour Party	Queens University of Belfast		No occupation found	
Andrew	Robathan	Conservative	Oriel College, Oxford	Modern History at Oriel College, University of Oxford, with a Bachelor of Arts , for campaigns that show risk and rigour	No occupation found	Historical & philosophical studies
Angus	Robertson	Scottish National Party	University of Aberdeen		Journalist	
Hugh	Robertson	Conservative	University of Reading	Land Management at the University of Reading from , a Distinguished Fellowship by the University of Reading  	No occupation found	Agriculture & related subjects
John	Robertson	Labour	No university found		No occupation found	
Laurence	Robertson	Conservative	University of Bolton	diploma in Management Services, engineer from , around 	No occupation found	Business & administrative studies
Geoffrey	Robinson	Labour	Clare College, Cambridge		No occupation found	
Dan	Rogerson	Liberal Democrat	University of Wales, Aberystwyth	Politics at the University of Wales Aberystwyth	No occupation found	Social studies
Andrew	Rosindell	Conservative	No university found		Parliamentarian	
Steve	Rotheram	Labour	John Moores University	part, a Masters in Contemporary Urban Renaissance, out the names of all ninety	No occupation found	Other
Frank	Roy	Labour	No university found		No occupation found	
Lindsay	Roy	Labour	No university found	a Bachelor of Science degree in 	No occupation found	Other
Chris	Ruane	Labour	No university found	BSc in Economics in , PGCE in , of parliamentary records was published in the Daily Telegraph, showed that 	No occupation found	Social studies
Amber	Rudd	Conservative	University of Edinburgh	from Edinburgh University with a degree in history, she joined J	Politician	Historical & philosophical studies
Joan	Ruddock	Labour	Imperial College London		No occupation found	
David	Ruffley	Conservative	Queens' College, Cambridge	at Queens	Solicitor (1985‚Äì91)	Other
Bob	Russell	Liberal Democrat	No university found		No occupation found	
David	Rutley	Conservative	London School of Economics	at the London School of Economics and Harvard Business School	Businessman	Social studies
Adrian	Sanders	Liberal Democrat	No university found	the Diabetes UK 	Politician	Other
Laura	Sandys	Conservative	No university found		No occupation found	
Anas	Sarwar	Labour	University of Glasgow	Dentistry at Glasgow University, in 	No occupation found	Subjects allied to medicine
Andy	Sawford	Labour	Durham University	in , history from Durham University he worked in Parliament for the then	No occupation found	Historical & philosophical studies
Lee	Scott	Conservative	No university found		No occupation found	
Alison	Seabeck	Labour	North East London Polytechnic	at the North East London Polytechnic 	No occupation found	Other
Andrew	Selous	Conservative	Eton College		MP	
Jim	Shannon	DUP	No university found	the General Service Medal	No occupation found	Other
Grant	Shapps	Conservative	Manchester Polytechnic	Higher National Diploma	No occupation found	Other
Alok	Sharma	Conservative	University of Salford	BSc in Applied Physics with electronics in 	Politician	Physical sciences
Virendra	Sharma	Labour	London School of Economics	donation from Indiatourism and have therefore never been liable to make a declaration in the Parliamentary register of members	Politician	Other
Barry	Sheerman	Labour	London School of Economics, University of London		Academic	
Alec	Shelbrooke	Conservative	Brunel University	from Brunel University in 	No occupation found	Other
Richard	Shepherd	Conservative	London School of Economics (BSc),	Bachelor of Science degree in Economics, and where he studied with and became a friend of Robert Kilroy	Underwriter	Social studies
Jim	Sheridan	Labour	No university found	from University College Dublin	Film director, screenwriter and producer	Other
Gavin	Shuker	Labour	Girton College, Cambridge	Social and Political Sciences 	No occupation found	Social studies
Mark	Simmonds	Conservative	Trent Polytechnic	BSc , Urban Estate Surveying in 	No occupation found	Other
David	Simpson	DUP	No university found		No occupation found	
Keith	Simpson	Conservative	University of Hull	lists, for his party	No occupation found	Other
Chris	Skidmore	Conservative	Christ Church, Oxford	in , Modern History 	No occupation found	Historical & philosophical studies
Dennis	Skinner	Labour	Ruskin College	the Guardian	No occupation found	Other
Andy	Slaughter	Labour	University of Exeter	English between , Law, qualifying as a barrister in 	No occupation found	Law
