First name	Last name	Party	Phrase	Occupation	Subject area
Andrew	Smith	Labour	No university found		No occupation found	
Angela	Smith	Labour	No university found		No occupation found	
Chloe	Smith	Conservative	University of York	English Literature at the University of York, from York University she joined Deloitte Touche Tohmatsu, 	Politician	Languages
Henry	Smith	Conservative	University College London	B	Member of Parliament	Other
Julian	Smith	Conservative	Birmingham University	English and History	No occupation found	Languages
Nick	Smith	Labour	No university found		No occupation found	
Owen	Smith	Labour	No university found	History and French at the University of Sussex	No occupation found	Languages
Robert	Smith	Liberal Democrat	No university found		No occupation found	
Nicholas	Soames	Conservative	No university found	at Mons Officer Cadet School	No occupation found	Other
Anna	Soubry	Conservative	No university found	in law from the University of Birmingham in , took place in February , provider could compete to treat the same hip	No occupation found	Law
John	Spellar	Labour	St Edmund Hall, Oxford		No occupation found	
Caroline	Spelman	Conservative	Queen Mary University of London	BA First Class in European Studies from Queen Mary College, University of London	No occupation found	Other
Mark	Spencer	Conservative	No university found	at Shuttleworth Agricultural College in Bedfordshire, before joining the family farm business	No occupation found	Agriculture & related subjects
John	Stanley	Conservative	No university found		No occupation found	
Andrew	Stephenson	Conservative	Royal Holloway, University of London	at Royal Holloway College, University of London, , with a degree in Management Studies in 	Insurance broker	Business & administrative studies
John	Stevenson	Conservative	No university found		No occupation found	
Bob	Stewart	Conservative	No university found		No occupation found	
Iain	Stewart	Conservative	Exeter University	politics at the University of Exeter before training as an accountant with Coopers , various rail links and rail systems	No occupation found	Social studies
Rory	Stewart	Conservative	Eton College	modern history and politics, philosophy and economics , the Royal Scottish Geographical Society, at school, in the Foreign Office, and on his Asian travels Latin, Greek, Russian, Chinese, Serbo	No occupation found	Social studies
Jack	Straw	Labour	University of Leeds	Law at the University of Leeds, with a , as a barrister at Inns of Court School of Law, practising criminal law for two years from 	No occupation found	Law
Gary	Streeter	Conservative	King's College London	first class honours degree in Law	No occupation found	Law
Mel	Stride	Conservative	St Edmund Hall, Oxford		No occupation found	
Graham	Stringer	Labour	University of Sheffield	in Chemistry from the University of Sheffield in 	No occupation found	Physical sciences
Gisela	Stuart	Labour	London School of Economics	from the University of London with an LLB in , through the University of London External System, in a British University	No occupation found	Law
Graham	Stuart	Conservative	Selwyn College, Cambridge	at Glenalmond College, an independent school in Perthshire, followed by Selwyn College at the University of Cambridge from , Philosophy and Law 	No occupation found	Law
Andrew	Stunell	Liberal Democrat	Victoria University of Manchester	, Architecture at University of Manchester and Liverpool Polytechnic, the Order of the British Empire in , edit	No occupation found	Architecture, building & planning
Julian	Sturdy	Conservative	Harper Adams University	at agricultural college	No occupation found	Agriculture & related subjects
Gerry	Sutcliffe	Labour	No university found		No occupation found	
Ian	Swales	Liberal Democrat	UMIST	as an accountant in 	No occupation found	Business & administrative studies
Desmond	Swayne	Conservative	University of St Andrews	Theology at St Marys College at the University of St Andrews	Bank manager	Historical & philosophical studies
Jo	Swinson	Liberal Democrat	London School of Economics	Management gaining a Bachelor of Science in , with a first class degree, , 	No occupation found	Business & administrative studies
Hugo	Swire	Conservative	Eton College		No occupation found	
Robert	Syms	Conservative	No university found		No occupation found	
Mark	Tami	Labour	University of Wales, Swansea	in history at the University of Wales, Swansea	No occupation found	Historical & philosophical studies
Peter	Tapsell	Conservative	No university found		No occupation found	
Sarah	Teather	Liberal Democrat	St John's College, Cambridge	, Natural Sciences specialising in pharmacology	No occupation found	Physical sciences
Gareth	Thomas	Labour	No university found		No occupation found	
Emily	Thornberry	Labour	University of Kent	law	Politician	Law
Mike	Thornton	Liberal Democrat	No university found		No occupation found	
John	Thurso	Liberal Democrat	Eton College		No occupation found	
Stephen	Timms	Labour	Emmanuel College, Cambridge	Mathematics at Emmanuel College, Cambridge where he gained an MA in Mathematics in 	No occupation found	Mathematical sciences
Edward	Timpson	Conservative	Durham University	politics before converting to law	No occupation found	Social studies
Justin	Tomlinson	Conservative	Oxford Brookes		No occupation found	
David	Tredinnick	Conservative	Eton College	MLitt	No occupation found	Languages
Jon	Trickett	Labour	No university found	at Roundhay Grammar School , BA in Politics from the University of Hull, and later an MA in Political Sociology from the University of Leeds	No occupation found	Social studies
Elizabeth	Truss	Conservative	Merton College, Oxford	both Ordinary Maths and Advanced Maths, Philosophy, Politics and Economics at Merton College, Oxford, management accountant, maths to , double A	Economist	Mathematical sciences
Andrew	Turner	Conservative	Keble College, Oxford	to be a teacher at the University of Birmingham and Henley Management College, GCSE maths and 	No occupation found	Mathematical sciences
Karl	Turner	Labour	University of Hull	Business Administration, law degree as a mature student at the University of Hull	No occupation found	Law
Derek	Twigg	Labour	No university found		No occupation found	
Stephen	Twigg	Labour	Balliol College, Oxford	Philosophy, Politics, and Economics	No occupation found	Social studies
Andrew	Tyrie	Conservative	Trinity College, Oxford;	PPE, graduating in , a postgraduate Certificate of Advanced European Studies 	Politician, Journalist	Social studies
Chuka	Umunna	Labour	University of Manchester	an upper second class LLB in English and French Law from the University of Manchester, he studied for one term at the University of Burgundy in Dijon, before studying for an MA at Nottingham Law School	MP	Social studies
Paul	Uppal	Conservative	University of Warwick	three A levels in Politics, History and Sociology at Matthew Boulton College, Politics and Sociology at the University of Warwick	No occupation found	Social studies
Edward	Vaizey	Conservative	No university found		No occupation found	
Shailesh	Vara	Conservative	Brunel University	as a solicitor, the accolade of official 	Solicitor	Law
Keith	Vaz	Labour	Gonville and Caius College, Cambridge	law and obtained a BA 	Member of Parliament	Law
Valerie	Vaz	Labour	No university found	Biochemistry in , as a solicitor 	Lawyer	Physical sciences
Martin	Vickers	Conservative	University of Lincoln		No occupation found	
Theresa	Villiers	Conservative	University of Bristol	Bachelor of Laws , she worked as a barrister and as a lecturer at King	No occupation found	Law
Charles	Walker	Conservative	No university found		No occupation found	
Robin	Walker	Conservative	St. Paul's School (Barnes, London)	Ancient and Modern History	MP	Historical & philosophical studies
Ben	Wallace	Conservative	No university found	criminal justice, year of probation and community service for punching Indiana players in the stands	No occupation found	Law
Joan	Walley	Labour	No university found	BA in Social Administration, Diploma in Community Work Development	No occupation found	Social studies
Robert	Walter	Conservative	Aston University	BSc in , an honorary doctorate, D	No occupation found	Medicine & dentistry
David	Ward	Liberal Democrat	No university found	as a member of the Chartered Institute of Public Finance and Accountancy , MSc from the University of Leicester	Member of Parliament	Business & administrative studies
Angela	Watkinson	Conservative	No university found	Public Administration Higher National Certificate from Anglia Higher Education College, of the Marriage 	No occupation found	Education
Tom	Watson	Labour	No university found		No occupation found	
Dave	Watts	Labour	No university found		No occupation found	
Mike	Weatherley	Conservative	London South Bank University	business studies at London South Bank University, ski instructor and football referee, and former centre	No occupation found	Business & administrative studies
Steve	Webb	Liberal Democrat	Hertford College, Oxford	Philosophy, Politics and Economics at Hertford College, Oxford	Academic	Social studies
Michael	Weir	Scottish National Party	No university found		No occupation found	
James	Wharton	Conservative	Durham University	Law , the Legal Practice Course at The College of Law in York and qualified as a solicitor with BHP Law, a firm in the Northeast, huge upswing in donations from rich, Conservative supporters  	Solicitor	Law
Heather	Wheeler	Conservative	No university found	as an Associate of the Chartered Insurance Institute	No occupation found	Other
Chris	White	Conservative	No university found	BEng in Engineering, and an MBA from the University of Bath	No occupation found	Engineering & technology
Eilidh	Whiteford	Scottish National Party	No university found	with First Class Honours in English and Scottish Literature, followed by postgraduate studies in Canada and Scotland that led to a PhD in 	university lecturer, charity manager	Languages
Alan	Whitehead	Labour	University of Southampton	Politics and Philosophy at the University of Southampton, was President of Southampton University Students	No occupation found	Social studies
Craig	Whittaker	Conservative	No university found		No occupation found	
John	Whittingdale	Conservative	University College London		No occupation found	
Bill	Wiggin	Conservative	Eton College	Economics at the Bangor University, gaining a Bachelor of Arts 	No occupation found	Social studies
David	Willetts	Conservative	Christ Church, Oxford	Philosophy, Politics and Economics, with a first class degree, mixed reception	No occupation found	Social studies
Hywel	Williams	Plaid Cymru	University of Wales, Cardiff	in psychology	No occupation found	Social studies
Mark	Williams	Liberal Democrat	University of Wales, Aberystwyth, University of Plymouth	politics	No occupation found	Social studies
Roger	Williams	Liberal Democrat	University of Cambridge	at Christ College, Brecon, and Selwyn College, Cambridge, in Natural Sciences he returned to Breconshire becoming a livestock farmer	No occupation found	Physical sciences
Stephen	Williams	Liberal Democrat	University of Bristol	in , History, as Chartered Tax Adviser and worked for several large firms including PriceWaterhouseCoopers and Grant Thornton, debate on the introduction of same sex marriage	Corporate Tax Advisor	Historical & philosophical studies
Chris	Williamson	Labour	De Montfort University	CQSW in 	No occupation found	Other
Gavin	Williamson	Conservative	University of Bradford	BSc degree in social sciences	No occupation found	Social studies
Jennifer	Willott	Liberal Democrat	No university found		No occupation found	
Phil	Wilson	Labour	No university found		No occupation found	
Rob	Wilson	Conservative	University of Reading	, edit	Politician	Other
Sammy	Wilson	DUP	Queen's University Belfast	Economics and Politics at both Queen, Finance Minister that Northern Ireland has had in decades	No occupation found	Social studies
David	Winnick	Labour	No university found		No occupation found	
Rosie	Winterton	Labour	University of Hull	for a BA in History at the University of Hull 	No occupation found	Historical & philosophical studies
Pete	Wishart	Scottish National Party	No university found		Musician, community worker	
Sarah	Wollaston	Conservative	King's College London	at King, reputation for being an independent, medicine, taking an additional course in pathology at the same time as her primary course, with a Bachelor of Science degree in Pathology in , in Medicine from King, candidate, rather than the candidate most in favour with the Government	No occupation found	Medicine & dentistry
Mike	Wood	Labour	No university found		No occupation found	
John	Woodcock	Labour	University of Edinburgh		No occupation found	
Shaun	Woodward	Labour	Jesus College, Cambridge	English literature, and Harvard University as a Kennedy Scholar, total of 	No occupation found	Languages
David	Wright	Labour	No university found	the , the nickname 	No occupation found	Other
Iain	Wright	Labour	University College London	with a BA in 	No occupation found	Other
Jeremy	Wright	Conservative	University of Exeter	Law degree from Exeter University	No occupation found	Law
Simon	Wright	Liberal Democrat	Imperial College London		No occupation found	
Tim	Yeo	Conservative	Emmanuel College, Cambridge	History and graduated in 	No occupation found	Historical & philosophical studies
George	Young	Conservative	No university found		No occupation found	
Nadhim	Zahawi	Conservative	University College London	Chemical Engineering, receiving a BSc, single bill covering both a meter in the stables and one in his house	Member of Parliament	Engineering & technology
